{
  "schemaVersion": 1,
  "cluster": {
    "name": "devnet",
    "rpcUrl": "https://api.devnet.solana.com",
    "genesisHash": "EtWTRABZaYq6iMfeYKouRu166VU2xqa1wcaWoxPkrZBG"
  },
  "programId": "6UoYT4jtiS23rCU1zARqnn181BxwuJ9waS1sv35gRg1Z",
  "token": {
    "programId": "TokenkegQfeZyiNwAJbNbGKPFXCWuBvf9Ss623VQ5DA",
    "displayLabel": "DEVTEST",
    "decimals": 6
  }
}
